model,text,reference,time,wer,cer,bleu_avg,rouge1_avg_f1,rougeL_avg_f1,levenshtein_avg,coqui_model,speaker_gender
Wav2Vec2 XLS-R 1B Italian Robust (DBDMG),redazione per vale in corso per il vei colorimocchio di marca amerciae succiasse contanna pesele non de deitininetico cro proveniente daitai latto po venuto il fine fortentitenti fie alleorettore i te cosisione viaro numerocivico selenti see infazione archeggie indoppia fia invivazione dellarticolosere con ma fie del colice civ deculsazione per vista eita pun imponsibile contestare immediaramente per a senza del traspe sone motivo alsenza del traspre sore stanpanecessaria tramite i fino italiano sampa anche la comuninazion,"Redazione verbale in corso per il veicolo rimorchio di marca Mercedes Classe A, con targa GH789IJ (tipo prova), proveniente da italia.  Fatto avvenuto il 05/04/2025 alle ore 02:18. Posizione: via Roma, numero civico 77. Infrazione: parcheggio in doppia fila, in violazione dell'articolo 7, comma 5, del codice civile. Decurtazione prevista: 8 punti. Impossibile contestare immediatamente per assenza del trasgressore, motivo: assenza del trasgressore. Stampa necessaria tramite wifi in italiano, stampa anche la comunicazione.",18.321320295333862,0.8356164383561644,0.3365019011406844,0.04847355498528725,0.2745098039215686,0.24836601307189543,177.0,unknown,unknown
"Wav2Vec2 XLSR Multilingual (voidful, 56 lang)",a relazione vebalinco soper il veicolo rimorchio di maccamerciade clase contaria tesere nombre de irininetipo proa proveniente deitale atopa penuto il fefourtentita entifialeoretorite posicione viaroa numero civicoseventisae infrazione parche giuinloppiafila invioazione dellarticoloseve con mafive del colice civir de cursazione pervista eidanimpossibile contestare immediaramente per assensa de trasresore motivo assenso del rasrssore sanpa necessaria trámite infin italiano sanpa anche la comunicazione,"Redazione verbale in corso per il veicolo rimorchio di marca Mercedes Classe A, con targa GH789IJ (tipo prova), proveniente da italia.  Fatto avvenuto il 05/04/2025 alle ore 02:18. Posizione: via Roma, numero civico 77. Infrazione: parcheggio in doppia fila, in violazione dell'articolo 7, comma 5, del codice civile. Decurtazione prevista: 8 punti. Impossibile contestare immediatamente per assenza del trasgressore, motivo: assenza del trasgressore. Stampa necessaria tramite wifi in italiano, stampa anche la comunicazione.",7.483537197113037,0.8082191780821918,0.3231939163498099,0.04556397930693726,0.28985507246376807,0.26086956521739135,170.0,unknown,unknown
Whisper Tiny (OpenAI)," il giorno toenti, un'etere 20, 20 fie, talle ore furazzero. è stato redattunverbale per il veicolo bom. seriaone. magchina e gricola in matricolato in crazia contarge e seveno un'dredeiditi ninega di tipoficiale.","Il giorno 21/03/2025, alle ore 04:00, è stato redatto un verbale per il veicolo BMW Serie 1, macchina agricola immatricolato in croazia con targa EP789GH di tipo ufficiale.L'infrazione è avvenuta in via Roma, al civico 77. È stata riscontrata una violazione del codice stradale, articolo 7, comma 5 ovvero parcheggio davanti a passo carrabileIl verbale è stato eseguito sul posto, con contestazione immediata da parte dell'agente Sara Bellini. Sono previsti 6 punti da decurtare, e non è stata applicata alcuna sanzione accessoria. Stampa in italiano tramite bluetooth, stampa anche la comunicazione.",1.095369577407837,0.9340659340659341,0.7716666666666666,0.006996652471860792,0.19199999999999998,0.16,464.0,unknown,unknown
Whisper Distilled IT (bofenghuang)," il giorno 20 bonetere 20 tue enti five alle ore fura a zero, è stato redatto un verbale per il veicolo bom, serie eone, macchina agricola immatricolato in croazia con targa e seveno undrede i diti mi nega di tipo ufficiale. l'inflazione avvenuta in via roma al civico seventi seveno. è stata riscontrata una violazione del codice stradale, articolo seven, con mafive ovvero parcheg","Il giorno 21/03/2025, alle ore 04:00, è stato redatto un verbale per il veicolo BMW Serie 1, macchina agricola immatricolato in croazia con targa EP789GH di tipo ufficiale.L'infrazione è avvenuta in via Roma, al civico 77. È stata riscontrata una violazione del codice stradale, articolo 7, comma 5 ovvero parcheggio davanti a passo carrabileIl verbale è stato eseguito sul posto, con contestazione immediata da parte dell'agente Sara Bellini. Sono previsti 6 punti da decurtare, e non è stata applicata alcuna sanzione accessoria. Stampa in italiano tramite bluetooth, stampa anche la comunicazione.",10.806788444519043,0.7802197802197802,0.6416666666666667,0.23442875159163493,0.5290322580645161,0.4903225806451613,386.0,unknown,unknown
Faster Whisper Tiny (Turbo)," il giorno 20, un'etere 20, 20, vive all'eore furazzero. è stato redatto un verbale per il veicolo  bom. seriaone, macchina e gricola in matricolato in crazia contarge e se venondre dei diti  nine gà di tipo ufficiale. l'infazione avvenuta in di aroma al cidico 77 è stata  riscontrato una violazione del codice stradale tatticolo seven, con ma fide ovvero perché  già davanti a passo carravile il verbale, stato eseguito sul posto con contestazione immediata  da parte dell'agente sara bellini. sono previsti si punti da decurtare e non è stata applicata  alcuna sanzione accessoria. stava in italiano tramite due dot stanvanche la comunicazione.","Il giorno 21/03/2025, alle ore 04:00, è stato redatto un verbale per il veicolo BMW Serie 1, macchina agricola immatricolato in croazia con targa EP789GH di tipo ufficiale.L'infrazione è avvenuta in via Roma, al civico 77. È stata riscontrata una violazione del codice stradale, articolo 7, comma 5 ovvero parcheggio davanti a passo carrabileIl verbale è stato eseguito sul posto, con contestazione immediata da parte dell'agente Sara Bellini. Sono previsti 6 punti da decurtare, e non è stata applicata alcuna sanzione accessoria. Stampa in italiano tramite bluetooth, stampa anche la comunicazione.",1.8775005340576172,0.5824175824175825,0.23666666666666666,0.26316975614895255,0.6358974358974357,0.6256410256410256,143.0,unknown,unknown
Vosk STT (Small IT),il giorno tu enti monetarie trecentoventi five alle ore fury zero è stato redatto un verbale per il veicolo bon serie one macchina agricola immatricolati in croazia con targa sebbene un tre dei ditemi nega di tipo ufficiale infrazione avvenuta in via roma hai civico se venti seven e stata riscontrata una violazione del codice stradale articolo seven con ma five ovvero parcheggia davanti a passo carabine il verbale stato eseguito sul posto con contestazione immediata da parte della gente sarà bellini sono previsti si punti da decurtare e non è stata applicata alcuna sanzione accessoria stava in italiano tramite due toto stampa anche la comunicazione,"Il giorno 21/03/2025, alle ore 04:00, è stato redatto un verbale per il veicolo BMW Serie 1, macchina agricola immatricolato in croazia con targa EP789GH di tipo ufficiale.L'infrazione è avvenuta in via Roma, al civico 77. È stata riscontrata una violazione del codice stradale, articolo 7, comma 5 ovvero parcheggio davanti a passo carrabileIl verbale è stato eseguito sul posto, con contestazione immediata da parte dell'agente Sara Bellini. Sono previsti 6 punti da decurtare, e non è stata applicata alcuna sanzione accessoria. Stampa in italiano tramite bluetooth, stampa anche la comunicazione.",1.8326237201690674,0.5274725274725275,0.24833333333333332,0.29167253721272446,0.7040816326530613,0.7040816326530613,149.0,unknown,unknown
Wav2Vec2 XLSR Italian (Grosman),il giorno tuenti uneteretventi tuenti five alle orefura azzero è stato redato un verbale per il veicolo com serieone macchina agricola immatricolato in croazie contargae sebenondre dei diti inega di tipo ufficiale lulfazione avvenutai via ro ai cvico seventiševeni è stata riscontrata una violazione del codice stradale artcolo sev<unk>n con mafire ovvero parcheggio davanti a passo carrabile i verbale stato eseguito sul posto con contestazione immediata da parte della gente sarabellini sono previstisui punti da decurtare e non è stata applicata alcuna sanzione accessoria stava in italiano tramite bluetot stava anche la comunicazione,"Il giorno 21/03/2025, alle ore 04:00, è stato redatto un verbale per il veicolo BMW Serie 1, macchina agricola immatricolato in croazia con targa EP789GH di tipo ufficiale.L'infrazione è avvenuta in via Roma, al civico 77. È stata riscontrata una violazione del codice stradale, articolo 7, comma 5 ovvero parcheggio davanti a passo carrabileIl verbale è stato eseguito sul posto, con contestazione immediata da parte dell'agente Sara Bellini. Sono previsti 6 punti da decurtare, e non è stata applicata alcuna sanzione accessoria. Stampa in italiano tramite bluetooth, stampa anche la comunicazione.",8.506875038146973,0.5164835164835165,0.25333333333333335,0.2969064107318904,0.6162162162162163,0.6054054054054054,152.0,unknown,unknown
Wav2Vec2 XLS-R 1B Italian Robust (DBDMG),il giorno toenti o niteretrentituenti five dalle ore fura azzero è stato redato un vervale per il veicolo gom serione ma chinalgricola immatricolato in crazia contarge ezseveno undre dei ditimi nega di tipo ufficiale un fazione avvelota ivia roma paicidico seventi sevei è state riscontrata una violazione del codice stradale atticolo seven con ma fide o vero parteggio davanti a passo carrabile il verbale stato eseguito sul posto con contestazione imvediata da parte della gente sarabellini sono previsti si punti da decortare e non è stata applicata al cuna sanzione accessoria stava in italiano tramite due etoto stamva anche la comunicazione,"Il giorno 21/03/2025, alle ore 04:00, è stato redatto un verbale per il veicolo BMW Serie 1, macchina agricola immatricolato in croazia con targa EP789GH di tipo ufficiale.L'infrazione è avvenuta in via Roma, al civico 77. È stata riscontrata una violazione del codice stradale, articolo 7, comma 5 ovvero parcheggio davanti a passo carrabileIl verbale è stato eseguito sul posto, con contestazione immediata da parte dell'agente Sara Bellini. Sono previsti 6 punti da decurtare, e non è stata applicata alcuna sanzione accessoria. Stampa in italiano tramite bluetooth, stampa anche la comunicazione.",21.946874856948853,0.6703296703296703,0.285,0.14336872541320186,0.5263157894736842,0.5052631578947369,171.0,unknown,unknown
"Wav2Vec2 XLSR Multilingual (voidful, 56 lang)",il giorno toenti uniteretrentituentifive al leore furaazero è stato rtoun verbale per il veicolo on srieone macchina agricola inmatricolato incroazie con targa esevenondre dei ditininega di tipo ufficiale nufazione averotavia roa alcivico seventiseven è state riscontrata una violazione del codice stradale articolo svcon ma fiveovvero parcheggio davanti a passo che arrabile il verbale statoeseguito sul posto con contestazione immediata da parte dellagente sarabellini sono previstisi punti da decurtare e non è stata applicata alcuna sanzione accessoria tava in italiano tramite duestamva anche la comunicazione,"Il giorno 21/03/2025, alle ore 04:00, è stato redatto un verbale per il veicolo BMW Serie 1, macchina agricola immatricolato in croazia con targa EP789GH di tipo ufficiale.L'infrazione è avvenuta in via Roma, al civico 77. È stata riscontrata una violazione del codice stradale, articolo 7, comma 5 ovvero parcheggio davanti a passo carrabileIl verbale è stato eseguito sul posto, con contestazione immediata da parte dell'agente Sara Bellini. Sono previsti 6 punti da decurtare, e non è stata applicata alcuna sanzione accessoria. Stampa in italiano tramite bluetooth, stampa anche la comunicazione.",8.889514684677124,0.5604395604395604,0.26666666666666666,0.237631326415126,0.5895953757225434,0.5780346820809249,160.0,unknown,unknown
Whisper Tiny (OpenAI)," si stare dicendo verbale per violazione, accertate il terre e fortuenti, tuenti, fie alle ore, tuenti, pune, forti tu, o in diale dei gerdini, al civico i tà, carico del veico lo vol suo agendolf, macchina e grico la contarge ai seveno un tre dei diti, di nine, da di tipo speciale, in matricolato in francia. la violazione contestata, perché giù indivieto di sostar in base","Si sta redigendo verbale per violazione accertata il 03/04/2025 alle ore 21:42 in viale dei Giardini, al civico 8, a carico del veicolo Volkswagen Golf, macchina agricola con targa IJ789KL di tipo speciale, immatricolato in francia. La violazione contestata è parcheggio in divieto di sosta, in base all'articolo 7, comma 15 del codice civile.La contestazione è avvenuta immediatamente da parte dell'agente Alessandro Moretti. Sono previsti 10 punti di decurtazione. Si richiede la stampa in lingua italiano via bluetooth, stampa anche la comunicazione.",1.6975042819976807,0.9390243902439024,0.6654611211573237,0.02488751572844779,0.3815789473684211,0.32894736842105265,369.0,unknown,unknown
Whisper Distilled IT (bofenghuang),"si sta redigendo verbale per violazione accertata il tareford 20-25 alle ore 20, pone, fortitu, o inviale dei giardini, al civico e il tà, a carico del veicolo volsua gengolf, macchina agricola con targa i7 o un 3 dei ghiti nineda di tipo speciale, immatricolato in francia. la violazione contestata parcheggio in divieto di sosta rimbase all'articolo 7,15 del codice civile.","Si sta redigendo verbale per violazione accertata il 03/04/2025 alle ore 21:42 in viale dei Giardini, al civico 8, a carico del veicolo Volkswagen Golf, macchina agricola con targa IJ789KL di tipo speciale, immatricolato in francia. La violazione contestata è parcheggio in divieto di sosta, in base all'articolo 7, comma 15 del codice civile.La contestazione è avvenuta immediatamente da parte dell'agente Alessandro Moretti. Sono previsti 10 punti di decurtazione. Si richiede la stampa in lingua italiano via bluetooth, stampa anche la comunicazione.",11.270383358001709,0.7073170731707317,0.5316455696202531,0.22604752830883743,0.5733333333333334,0.5733333333333334,294.0,unknown,unknown
Faster Whisper Tiny (Turbo)," si stare dicendo verbale per violazione, accertate il terre e fortuenti, tu enti fidi alle ore, tu enti,  pune, forti tu, o in diale dei gerdini, al civico i tà, a carico del veico lo volso a gengolf,  macchina e grico la contarge ai seveno un tre dei diti mineda di tipo speciale, in matricolato  in francia. la violazione contestata, perché giù indivieto di sostar in base all'articolo  sevene con macchistende i codice civie. la contestazione avvenuta immediatamente la parte dell'agente  alle sandro moretti. sono previstiti in punti di decurtazione. si richiede la stampa in lingue italiano via  lui e tote, stampa anche la comunicazione.","Si sta redigendo verbale per violazione accertata il 03/04/2025 alle ore 21:42 in viale dei Giardini, al civico 8, a carico del veicolo Volkswagen Golf, macchina agricola con targa IJ789KL di tipo speciale, immatricolato in francia. La violazione contestata è parcheggio in divieto di sosta, in base all'articolo 7, comma 15 del codice civile.La contestazione è avvenuta immediatamente da parte dell'agente Alessandro Moretti. Sono previsti 10 punti di decurtazione. Si richiede la stampa in lingua italiano via bluetooth, stampa anche la comunicazione.",1.9246656894683838,0.8048780487804879,0.3128390596745027,0.10465008845636675,0.5595854922279792,0.538860103626943,174.0,unknown,unknown
Vosk STT (Small IT),si stare dicendo verbale per violazione accertate tara i furto enti tu enti five alle ore tu enti pone fatti tu po' inviare dei giardini al civico età carico del veicolo volkswagen golf macchina agricola con targa i seven un tre dei di nine da di tipo speciale immatricolati in francia la violazione contestata parcheggio indietro di sosta invase all'articolo seven con ma si stende codice civile la contestazione avvenuta immediatamente era parte della gente alessandro moretti sono previsti tempo di di decurtazione si richiede la stampa in lingua italiano via lui toto stava anche la comunicazione,"Si sta redigendo verbale per violazione accertata il 03/04/2025 alle ore 21:42 in viale dei Giardini, al civico 8, a carico del veicolo Volkswagen Golf, macchina agricola con targa IJ789KL di tipo speciale, immatricolato in francia. La violazione contestata è parcheggio in divieto di sosta, in base all'articolo 7, comma 15 del codice civile.La contestazione è avvenuta immediatamente da parte dell'agente Alessandro Moretti. Sono previsti 10 punti di decurtazione. Si richiede la stampa in lingua italiano via bluetooth, stampa anche la comunicazione.",1.8061861991882324,0.7682926829268293,0.27486437613019893,0.14240751889094114,0.6195652173913043,0.6086956521739131,152.0,unknown,unknown
Wav2Vec2 XLSR Italian (Grosman),si sta redigendo verbale per violazione accertata i terei furtuenti tuenti five alle ore tuenti o fottitù o inviale dei giardini al civico ità a carico del veicolo vol-suagengolf macchina agricola con targais e venondre dei diti mineda di tipo speciale immatricolato in francia la violazione contestata parcheggio indivieto di sostar in base all'articolo seven con maffistein del codice civile la contestazione avvenuta immediatamente da parte della gente alessandro moretti sono previsti tainpunti di decortazione si richiede la stampa in lingua italiano via bluetot stava anche la comunicazione,"Si sta redigendo verbale per violazione accertata il 03/04/2025 alle ore 21:42 in viale dei Giardini, al civico 8, a carico del veicolo Volkswagen Golf, macchina agricola con targa IJ789KL di tipo speciale, immatricolato in francia. La violazione contestata è parcheggio in divieto di sosta, in base all'articolo 7, comma 15 del codice civile.La contestazione è avvenuta immediatamente da parte dell'agente Alessandro Moretti. Sono previsti 10 punti di decurtazione. Si richiede la stampa in lingua italiano via bluetooth, stampa anche la comunicazione.",7.685151100158691,0.5609756097560976,0.23508137432188064,0.23736549592349407,0.6818181818181818,0.6818181818181818,130.0,unknown,unknown
Wav2Vec2 XLS-R 1B Italian Robust (DBDMG),si staredigendo vervale per violazione accertata il terei fortuentituenti fide al le ore toenti one fotti tutpo inviale dei giardini al civicoità a carico del veicolo vol suagengoalfmacchinai gricola contarga i se veno untre dei ditimineda di tipo speciale in matricolato in francia la violazione contestata parcheggio indivieto di sostar invase allarticolo seven con ma fistendel codice civie la contestazione davvenute immediatamente da parte della gente a lessandromoretti sono previstitemponti di decortazione si richiede la stampa i lingoe italiano via luetote stava anche la comunicazione,"Si sta redigendo verbale per violazione accertata il 03/04/2025 alle ore 21:42 in viale dei Giardini, al civico 8, a carico del veicolo Volkswagen Golf, macchina agricola con targa IJ789KL di tipo speciale, immatricolato in francia. La violazione contestata è parcheggio in divieto di sosta, in base all'articolo 7, comma 15 del codice civile.La contestazione è avvenuta immediatamente da parte dell'agente Alessandro Moretti. Sono previsti 10 punti di decurtazione. Si richiede la stampa in lingua italiano via bluetooth, stampa anche la comunicazione.",19.5916531085968,0.7439024390243902,0.28028933092224234,0.10334947296524637,0.49122807017543857,0.4678362573099415,155.0,unknown,unknown
"Wav2Vec2 XLSR Multilingual (voidful, 56 lang)",si sta ridigendo verbale per violazione accertate i treifortentituentifive al leore tuenti one fatti o indiale dei giardini alcivicoità a carico del veicolo vol sua gengolfmachina agricola contargaise venontre dei ditininedadi tipo speciale in matricolato in francia la violazione contestata tarcheggio indivieto di sostar in vase allarticolo svcomma fistin dei codice civie la contestazione a venuta inmmediatamente da parte della gente alessandro moret sono previstiten punti di decortazione si richiede la stampa in lingua italiano via blueo stampa anche la comunicazione,"Si sta redigendo verbale per violazione accertata il 03/04/2025 alle ore 21:42 in viale dei Giardini, al civico 8, a carico del veicolo Volkswagen Golf, macchina agricola con targa IJ789KL di tipo speciale, immatricolato in francia. La violazione contestata è parcheggio in divieto di sosta, in base all'articolo 7, comma 15 del codice civile.La contestazione è avvenuta immediatamente da parte dell'agente Alessandro Moretti. Sono previsti 10 punti di decurtazione. Si richiede la stampa in lingua italiano via bluetooth, stampa anche la comunicazione.",8.802007913589478,0.6463414634146342,0.24773960216998192,0.155423619341801,0.5269461077844311,0.5029940119760479,137.0,unknown,unknown
Whisper Tiny (OpenAI)," sino tifica la presenza di un preavviso di violazione, però il veicolo macchino operatrice, marcare naudaglio, tarde a i seveno un 3 dei diti, di nine la di tipo prova, di matricolato in germania. la violazione avvenuta il terti un'etretventi tventi fide alle ore, nine te infatti, nine indiete, dell'are pubbica, al numero civico tuenti, ed è relativa, perché due ind","Si notifica la presenza di un preavviso di violazione per il veicolo macchina operatrice, marca Renault Clio, targa IJ789KL di tipo prova, immatricolato in germania. La violazione è avvenuta il 31/03/2025 alle ore 19:49 in via della Repubblica, al numero civico 20, ed è relativa a parcheggio in doppia fila, in base all'articolo 7, comma 15 del codice stradale.Per tale violazione sono previsti 2 punti di decurtazione. Si richiede la stampa di tale preavviso in lingua italiano tramite bluetooth, non stampare anche la comunicazione.",1.7431211471557617,0.8809523809523809,0.6018691588785047,0.10372962816822787,0.4161073825503356,0.36241610738255037,323.0,unknown,unknown
Whisper Distilled IT (bofenghuang),"si notifica la presenza di un preavviso di violazione però il veicolo macchina operatrice, marca renaud taglio, targa iseveno un 3 dei ghiti ninella di tipo prova, immatricolato in germania. la violazione avvenuta ai terzi onetere 20-25 alle ore nine tain, fotti nine in via della repubblica, al numero civico 20, ed è relativa a parcheggio in doppia fila in base all'articolo 7, con ma","Si notifica la presenza di un preavviso di violazione per il veicolo macchina operatrice, marca Renault Clio, targa IJ789KL di tipo prova, immatricolato in germania. La violazione è avvenuta il 31/03/2025 alle ore 19:49 in via della Repubblica, al numero civico 20, ed è relativa a parcheggio in doppia fila, in base all'articolo 7, comma 15 del codice stradale.Per tale violazione sono previsti 2 punti di decurtazione. Si richiede la stampa di tale preavviso in lingua italiano tramite bluetooth, non stampare anche la comunicazione.",9.93558645248413,0.6190476190476191,0.514018691588785,0.33432896256861555,0.6143790849673203,0.6143790849673203,275.0,unknown,unknown
Faster Whisper Tiny (Turbo)," sinotifica la presenza di un preavviso di violazione, però il veicolo macchino  o peratrice, marcarina autaglio, tarde ai seveno un 3 dei diti nine la di tipo  prova, immatricolato in germania.  la violazione ha venuta i terti un'etretventi tventi fide alle orenine e infatti  nime india dell'are pubbica, al numero civico tventi, ed è relativa a parché due indopia  fila, ti invasi all'articolo sevene, con mafittende il codice stradale.  aertale violazione sono previstituo punti di decortazione, si richiede la stampadità  le previso in lingua italiano tramite due toto, non ston pare anche la comunicazione.","Si notifica la presenza di un preavviso di violazione per il veicolo macchina operatrice, marca Renault Clio, targa IJ789KL di tipo prova, immatricolato in germania. La violazione è avvenuta il 31/03/2025 alle ore 19:49 in via della Repubblica, al numero civico 20, ed è relativa a parcheggio in doppia fila, in base all'articolo 7, comma 15 del codice stradale.Per tale violazione sono previsti 2 punti di decurtazione. Si richiede la stampa di tale preavviso in lingua italiano tramite bluetooth, non stampare anche la comunicazione.",1.8469972610473633,0.6785714285714286,0.3177570093457944,0.19698958933407934,0.5027322404371585,0.4918032786885246,171.0,unknown,unknown
Vosk STT (Small IT),si notifica la presenza di un preavviso di violazione però il veicolo macchina operatrice marca renault a io targa i seven un tre dei ditemi nera di tipo prova immatricolati in germania la violazione è avvenuta etere non etere venti tu enti five alle ore nine te infatti nine in via della repubblica al numero civico tu enti ed è relativa a parcheggio in doppia fila invase all'articolo seven con ma fish tende il codice stradale tale violazione sono previsti tuo punti di decurtazione si richiede la stampa digitale preavviso in lingua italiano tramite due toto non stampare anche la comunicazione,"Si notifica la presenza di un preavviso di violazione per il veicolo macchina operatrice, marca Renault Clio, targa IJ789KL di tipo prova, immatricolato in germania. La violazione è avvenuta il 31/03/2025 alle ore 19:49 in via della Repubblica, al numero civico 20, ed è relativa a parcheggio in doppia fila, in base all'articolo 7, comma 15 del codice stradale.Per tale violazione sono previsti 2 punti di decurtazione. Si richiede la stampa di tale preavviso in lingua italiano tramite bluetooth, non stampare anche la comunicazione.",1.6607003211975098,0.5833333333333334,0.2616822429906542,0.27879721660209367,0.716577540106952,0.7058823529411765,140.0,unknown,unknown
