model,text,reference,time,wer,cer,bleu_avg,rouge1_avg_f1,rougeL_avg_f1,levenshtein_avg,coqui_model,speaker_gender
Whisper Tiny (OpenAI), il giorno tuo forto antituenti fibre alle ore se ben fitti è stato reto un verba le per il veicolo aldi a tere motovacolo in matricolato inolanda contarte da fuura un tre fitti si fitti tipo speciale. l'infrazione avvenute in diale dei gerdini al cívico è stata riscontrato una violazione dei codice penale atticolone un tre dei vieti fibre con matupo ouvro perché giudavanti a passo carravideno è stato possibile,"Il giorno 02/04/2025, alle ore 07:50, è stato redatto un verbale per il veicolo Audi A3, motoveicolo immatricolato in olanda con targa ZA456QP di tipo speciale.L'infrazione è avvenuta in viale dei Giardini, al civico 8. È stata riscontrata una violazione del codice penale, articolo 185, comma 2 ovvero parcheggio davanti a passo carrabileNon è stato possibile contestare sul posto a causa dell'assenza del trasgressore. Sono previsti 3 punti da decurtare, e non è stata applicata alcuna sanzione accessoria. Stampa in italiano tramite wifi, non stampare anche la comunicazione.",2.0852103233337402,0.8977272727272727,0.5882352941176471,0.029809221345320526,0.3670886075949367,0.32911392405063294,341.0,unknown,unknown
Whisper Distilled IT (bofenghuang)," il giorno tuo fur 20-20, alle ore 7.50, è stato redatto un verbale per il veicolo audi, a3, motoveicolo immatricolato in olanda con targa zaffur a ondre fitti, sicchi di tipo speciale. l'infrazione avvenuta in viale dei giardini al civico e.c. è stata riscontrata una violazione del codice penale, articolone ondre dei gheti five, con mattu, ovvero parcheggio davanti a","Il giorno 02/04/2025, alle ore 07:50, è stato redatto un verbale per il veicolo Audi A3, motoveicolo immatricolato in olanda con targa ZA456QP di tipo speciale.L'infrazione è avvenuta in viale dei Giardini, al civico 8. È stata riscontrata una violazione del codice penale, articolo 185, comma 2 ovvero parcheggio davanti a passo carrabileNon è stato possibile contestare sul posto a causa dell'assenza del trasgressore. Sono previsti 3 punti da decurtare, e non è stata applicata alcuna sanzione accessoria. Stampa in italiano tramite wifi, non stampare anche la comunicazione.",15.268608331680298,0.6931818181818182,0.5294117647058824,0.24729112489159438,0.5960264900662252,0.5695364238410596,307.0,unknown,unknown
Faster Whisper Tiny (Turbo)," il giorno tuo forto anti-twenty-five alle ore se ben fitti. è stato un verbale per il veicolo  aldi, attere, motovicolo in matricolato inolanda contarte da fuura a un tre fitti  sifichi di tipo speciale. l'infrazione avvenute in diale dei gerdini al cívico, è stata  riscontrato una violazione dei codice penale atticolone, un tre dei vieti five, con matt'u  ovvero perché giudavanti a passo carrabile non è stato possibile contestare sul posto  a causa dell'assenza del trascresore. sono previstitere punti da decortare e non è stata  applicata alcuna sanzione accessoria. stà paimita agliano tramite ufii, non ston pare anche  la comunicazione.","Il giorno 02/04/2025, alle ore 07:50, è stato redatto un verbale per il veicolo Audi A3, motoveicolo immatricolato in olanda con targa ZA456QP di tipo speciale.L'infrazione è avvenuta in viale dei Giardini, al civico 8. È stata riscontrata una violazione del codice penale, articolo 185, comma 2 ovvero parcheggio davanti a passo carrabileNon è stato possibile contestare sul posto a causa dell'assenza del trasgressore. Sono previsti 3 punti da decurtare, e non è stata applicata alcuna sanzione accessoria. Stampa in italiano tramite wifi, non stampare anche la comunicazione.",2.28438663482666,0.6363636363636364,0.3044982698961938,0.24744227102955288,0.5549738219895288,0.544502617801047,177.0,unknown,unknown
Vosk STT (Small IT),giorno tuo furto enti tu enti five alle ore seven fitti è stato redatto un verbale per è il veicolo audi sarei motoveicoli immatricolati in olanda con targa zaha furia un tre fitti si fidi tipo speciale infrazione avvenuta in viale dei giardini il civico e e stata riscontrata una violazione del codice penale articolo ne un tre dei chieti five con ma tu povero parcheggio davanti a passo carabine non è stato possibile contestare sul posto a causa dell'assenza del trasgressori sono previsti terra e punti da decurtare e non è stata applicata alcuna sanzione accessoria stata in italiano tramite wifi non stampare anche la comunicazione,"Il giorno 02/04/2025, alle ore 07:50, è stato redatto un verbale per il veicolo Audi A3, motoveicolo immatricolato in olanda con targa ZA456QP di tipo speciale.L'infrazione è avvenuta in viale dei Giardini, al civico 8. È stata riscontrata una violazione del codice penale, articolo 185, comma 2 ovvero parcheggio davanti a passo carrabileNon è stato possibile contestare sul posto a causa dell'assenza del trasgressore. Sono previsti 3 punti da decurtare, e non è stata applicata alcuna sanzione accessoria. Stampa in italiano tramite wifi, non stampare anche la comunicazione.",2.029376745223999,0.5568181818181818,0.24567474048442905,0.33647840930542555,0.7046632124352331,0.694300518134715,142.0,unknown,unknown
Wav2Vec2 XLSR Italian (Grosman),il giorno tuo furtuenti tuenti five alle oresewnfiffi è stato to un verbale per il veicolo audi aterei motoveicolo immatricolato in olanda con targazafurundraefittisifi di tipo speciale in frazione avvenuta in viale dei giardini alcivico ei è stata riscontrata una violazione del codice penale artcolo neundre dei dietifive con movvero parcheggio davanti a passo carrabile non è stato possibile contestare sul posto a causa dell'assenza del trasgressore sono previsti tere punti da decurtare e non è stata applicata alcuna sanzione accessoria stapa in italiano tramite uifi non stampare anche la comunicazione,"Il giorno 02/04/2025, alle ore 07:50, è stato redatto un verbale per il veicolo Audi A3, motoveicolo immatricolato in olanda con targa ZA456QP di tipo speciale.L'infrazione è avvenuta in viale dei Giardini, al civico 8. È stata riscontrata una violazione del codice penale, articolo 185, comma 2 ovvero parcheggio davanti a passo carrabileNon è stato possibile contestare sul posto a causa dell'assenza del trasgressore. Sono previsti 3 punti da decurtare, e non è stata applicata alcuna sanzione accessoria. Stampa in italiano tramite wifi, non stampare anche la comunicazione.",11.835169792175293,0.42045454545454547,0.20761245674740483,0.39329218179831094,0.7344632768361583,0.7344632768361583,120.0,unknown,unknown
Wav2Vec2 XLS-R 1B Italian Robust (DBDMG),il giorno tu fortuentituenti five alle ore sevenfifti è statoredato un vervale per il veicolo audi aterei motoveicolo in matricolato in olanda contarga za fura undreefitti si fiditipo speciale infrazione avvenuta inviale dei giardini al cidico iaè stata riscontrata una violazione del codice penale atticolone undre dei deti five con matto ovvero parcheggio davanti a passo carrabile non è stato possibile contestare sul posto a causa della senza del trascressore sono previstite repunti da decortare e non è stata applicata alcuna sanzione accessoria stapa in italiano tramiteuifi non stompare anche la comunicazione,"Il giorno 02/04/2025, alle ore 07:50, è stato redatto un verbale per il veicolo Audi A3, motoveicolo immatricolato in olanda con targa ZA456QP di tipo speciale.L'infrazione è avvenuta in viale dei Giardini, al civico 8. È stata riscontrata una violazione del codice penale, articolo 185, comma 2 ovvero parcheggio davanti a passo carrabileNon è stato possibile contestare sul posto a causa dell'assenza del trasgressore. Sono previsti 3 punti da decurtare, e non è stata applicata alcuna sanzione accessoria. Stampa in italiano tramite wifi, non stampare anche la comunicazione.",26.624857902526855,0.5681818181818182,0.22837370242214533,0.2716085912940288,0.6179775280898876,0.5955056179775281,132.0,unknown,unknown
"Wav2Vec2 XLSR Multilingual (voidful, 56 lang)",il giorno tuvo fortuentituentifive al leoresevenfifti è stato reato un verbale per il vehicolo audi atere motoveicolo in matricolato in olanda con targazafura undrefitici fiditipo special infrazione avvenuta indiale dei giardini alcivicoica è state riscontrato una violazione del codice penale atticolo uneundredeiditi five con mato overo parcheggio davanti a passo che rabile non è stato possibile contestare sul posto a causa dellassenza del transgresoe sono previsti terepuntida de cortare e non è stata aplicata alcuna sanzione accessoria stapa in italiano tramite wifinoston pare anche la comunicazione,"Il giorno 02/04/2025, alle ore 07:50, è stato redatto un verbale per il veicolo Audi A3, motoveicolo immatricolato in olanda con targa ZA456QP di tipo speciale.L'infrazione è avvenuta in viale dei Giardini, al civico 8. È stata riscontrata una violazione del codice penale, articolo 185, comma 2 ovvero parcheggio davanti a passo carrabileNon è stato possibile contestare sul posto a causa dell'assenza del trasgressore. Sono previsti 3 punti da decurtare, e non è stata applicata alcuna sanzione accessoria. Stampa in italiano tramite wifi, non stampare anche la comunicazione.",9.813753128051758,0.5681818181818182,0.24740484429065743,0.23556179629977805,0.5964912280701754,0.5614035087719298,143.0,unknown,unknown
Whisper Tiny (OpenAI)," sì a amvisa che in corso la se sura di un premmiso di violazione per i vei colori mochi o contarre dione con delle tenti teregli un diti gofficale, accavolza genvolta, proveniente da grecia. infrazione, nello specifico parché gendopia pia, se verificate in lada che intente le orienti tenti fie alle ore tentione, tenti trembia della repuglita, a numero tenti atticolo port","Si avvisa che è in corso la stesura di un preavviso di violazione per il veicolo rimorchio con targa IJ123KL di tipo ufficiale, marca Volkswagen Golf, proveniente da grecia. L'infrazione, nello specifico parcheggio in doppia fila, si è verificata in data 18/03/2025 alle ore 21:23 in via della Repubblica, al numero 20 (articolo 14, comma 1 del codice civile). Si comunica che dalla violazione conseguirà una decurtazione di 8 punti.Si richiede la stampa in lingua italiano, modalità wifi, non stampare anche la comunicazione.",1.7838215827941895,0.8674698795180723,0.55893536121673,0.03233067889420375,0.2972972972972973,0.2837837837837838,295.0,unknown,unknown
Whisper Distilled IT (bofenghuang),"si avvisa che è in corso la stesura di un preavviso di violazione per il veicolo rimorchio con targhe, milone, con delle tenti per elimidico ufficiale, marca volsagen volta, proveniente da grecia. l'infrazione, nello specifico parcheggio in doppia fila, si è verificata in data, per intendere le tenti tenti per elio e ore tentione, tenti per invia della repubblica, al numero 20 artic","Si avvisa che è in corso la stesura di un preavviso di violazione per il veicolo rimorchio con targa IJ123KL di tipo ufficiale, marca Volkswagen Golf, proveniente da grecia. L'infrazione, nello specifico parcheggio in doppia fila, si è verificata in data 18/03/2025 alle ore 21:23 in via della Repubblica, al numero 20 (articolo 14, comma 1 del codice civile). Si comunica che dalla violazione conseguirà una decurtazione di 8 punti.Si richiede la stampa in lingua italiano, modalità wifi, non stampare anche la comunicazione.",12.226394891738892,0.6506024096385542,0.4752851711026616,0.32711162263993876,0.5405405405405406,0.5405405405405406,250.0,unknown,unknown
Faster Whisper Tiny (Turbo)," se avvisa che in corso la sessura di un premviso di violazione per i vei colori mochi o contarre,  di one, con delle tenti terregli un dico officiale, accavolza genvolta, proveniente da grecia.  infrazione, nello specifico package in doppia pia, se verificate in lada e intentere  e ententententifici alle ore tenti one, tenti tre imbia della repubbita, a un numero tenti  di colo portè con mone dico i cecii.  si comunita che dalla violazione consegui una reputazione di indaccomma,  si richiede la stampa in lingue italiano, modalità richi, non stampare anche la comunazione.","Si avvisa che è in corso la stesura di un preavviso di violazione per il veicolo rimorchio con targa IJ123KL di tipo ufficiale, marca Volkswagen Golf, proveniente da grecia. L'infrazione, nello specifico parcheggio in doppia fila, si è verificata in data 18/03/2025 alle ore 21:23 in via della Repubblica, al numero 20 (articolo 14, comma 1 del codice civile). Si comunica che dalla violazione conseguirà una decurtazione di 8 punti.Si richiede la stampa in lingua italiano, modalità wifi, non stampare anche la comunicazione.",2.1062774658203125,0.6867469879518072,0.3726235741444867,0.11625558422951864,0.4692737430167597,0.4581005586592179,197.0,unknown,unknown
Vosk STT (Small IT),si vista è in corso l'assessora di un preavviso di violazione per il veicolo rimorchio contare i one tenti torelli di tipo ufficiale vacca volkswagen golf a proveniente da grecia l'infrazione nello specifico parcheggia in doppia fila si verificate andata essere tenti tenti si e le ore tensione enti prendi a della repubblica al numero pensi articolo forse con money del codice ci si comunita e dall'aviazione conseguire una reputazione di si richiede la sappia lingua italiano modalita hi fi non sa fare anche la comunicazione,"Si avvisa che è in corso la stesura di un preavviso di violazione per il veicolo rimorchio con targa IJ123KL di tipo ufficiale, marca Volkswagen Golf, proveniente da grecia. L'infrazione, nello specifico parcheggio in doppia fila, si è verificata in data 18/03/2025 alle ore 21:23 in via della Repubblica, al numero 20 (articolo 14, comma 1 del codice civile). Si comunica che dalla violazione conseguirà una decurtazione di 8 punti.Si richiede la stampa in lingua italiano, modalità wifi, non stampare anche la comunicazione.",2.129084348678589,0.6746987951807228,0.2870722433460076,0.157175688692396,0.5747126436781609,0.5632183908045977,151.0,unknown,unknown
Wav2Vec2 XLSR Italian (Grosman),si avvisa che in corso l'assesura di un preavviso di vivazione per il vericolorimorchio contarre ione onvertentitre inditico ufficiale barcavol sa-gengolfa proveniente da grecial'infrazione nello specifico parcheggio in doppia fila si è verificata in data evitenteretentitentifi all'eoretentione ventitré in via della repubblica al numero tenti artic fourtainne commone del codice civilesi comunica che dalla violazione conseguì una depurtazione di ligapusi richiede la sabba in lingua italiano modali tarifi non sampare anche la comunicazione,"Si avvisa che è in corso la stesura di un preavviso di violazione per il veicolo rimorchio con targa IJ123KL di tipo ufficiale, marca Volkswagen Golf, proveniente da grecia. L'infrazione, nello specifico parcheggio in doppia fila, si è verificata in data 18/03/2025 alle ore 21:23 in via della Repubblica, al numero 20 (articolo 14, comma 1 del codice civile). Si comunica che dalla violazione conseguirà una decurtazione di 8 punti.Si richiede la stampa in lingua italiano, modalità wifi, non stampare anche la comunicazione.",7.691667556762695,0.4939759036144578,0.26425855513307983,0.1978964381258314,0.6172839506172839,0.6049382716049383,139.0,unknown,unknown
Wav2Vec2 XLS-R 1B Italian Robust (DBDMG),si a visa e in corso la sesura di un preavviso di vilazine per il decolo rimocchio contare ione on veletentiterelli ditico ufficiale a cavolza gelvolfa proveniente da grece linfazione nello specifico parchegendoppia fia si è verificata indata e li tentere tentitenti fie a lerore tentione entintrembia della repubblita al numero tente articolo forfe con mone del coice ci si comunita ce dalla vilazione conseguì una decutazione di elita pun si richiede la stampe inlingua italiano voladitalifi non stampare anche la comuninazioni,"Si avvisa che è in corso la stesura di un preavviso di violazione per il veicolo rimorchio con targa IJ123KL di tipo ufficiale, marca Volkswagen Golf, proveniente da grecia. L'infrazione, nello specifico parcheggio in doppia fila, si è verificata in data 18/03/2025 alle ore 21:23 in via della Repubblica, al numero 20 (articolo 14, comma 1 del codice civile). Si comunica che dalla violazione conseguirà una decurtazione di 8 punti.Si richiede la stampa in lingua italiano, modalità wifi, non stampare anche la comunicazione.",19.767839670181274,0.6867469879518072,0.3231939163498099,0.10520785795456113,0.41916167664670656,0.40718562874251496,170.0,unknown,unknown
"Wav2Vec2 XLSR Multilingual (voidful, 56 lang)",sia visa e incossolo assesura di un previso di vivazione per il veicolorimorchio contare ione conreletentitereinditico ufficiale accavolsa genvolfa proveniente da grecia linfrazione nello specifico parcheggioindoppia fia sièverificate in dada e intenteretentitentifieleoretentione entitrembia della repubblica al numero tenci aricoloforten commone del coice civil sicomunica che dallaviazione consegui una decutazione di elita si richiede la sampa inlingua italiano modalitaifi non sappar anche la comunicazione,"Si avvisa che è in corso la stesura di un preavviso di violazione per il veicolo rimorchio con targa IJ123KL di tipo ufficiale, marca Volkswagen Golf, proveniente da grecia. L'infrazione, nello specifico parcheggio in doppia fila, si è verificata in data 18/03/2025 alle ore 21:23 in via della Repubblica, al numero 20 (articolo 14, comma 1 del codice civile). Si comunica che dalla violazione conseguirà una decurtazione di 8 punti.Si richiede la stampa in lingua italiano, modalità wifi, non stampare anche la comunicazione.",10.605087518692017,0.7349397590361446,0.30038022813688214,0.013336193058193167,0.4000000000000001,0.4000000000000001,158.0,unknown,unknown
Whisper Tiny (OpenAI)," con la secura di un verba liberi veicolo macchina ricola, ha capient panna, t'ha creato trono un reto enti terren, di tipo speciale, proveniente da porturarlo. infaccione è stata fievate il 70% di t'ideale ore si chiostare. il veicolo si trovava in corso buono singale e vesi, accivi con i neti dei tà, infarché gendò piaccia, io andolo la tipolo folo con matto","Procedo con la stesura di un verbale per il veicolo macchina agricola, marca Fiat Panda, targato CD123AB (di tipo speciale), proveniente da portogallo.  L'infrazione è stata rilevata il 17/04/2025 alle ore 06:33. Il veicolo si trovava in corso Buenos Aires, al civico 98, in parcheggio in doppia fila, violando l'articolo 4, comma 2, del codice stradale. L'agente Alessandro Moretti ha provveduto alla contestazione immediata dell'infrazione. La violazione comporta la perdita di 9 punti.  Richiedo la stampa del verbale in italiano tramite wifi, stampa anche la comunicazione.",2.7333102226257324,0.8604651162790697,0.6273830155979203,0.06804374337883405,0.2948717948717949,0.26923076923076916,361.0,unknown,unknown
Whisper Distilled IT (bofenghuang),"procedo con l'assessura di un verbale per il veicolo macchina ne ricorda, ma capirà panda, targato su un'ombre retentil terreno, di tipo speciale, proveniente da portogallo. l'infrazione, è stata rilevata il 6 in tempo utenti tempi in fila alle ore sì, il terreno. il veicolo si trovava in corso buenos aires, a civico-minedi di tà, in parcheggio in doppia fila, viol","Procedo con la stesura di un verbale per il veicolo macchina agricola, marca Fiat Panda, targato CD123AB (di tipo speciale), proveniente da portogallo.  L'infrazione è stata rilevata il 17/04/2025 alle ore 06:33. Il veicolo si trovava in corso Buenos Aires, al civico 98, in parcheggio in doppia fila, violando l'articolo 4, comma 2, del codice stradale. L'agente Alessandro Moretti ha provveduto alla contestazione immediata dell'infrazione. La violazione comporta la perdita di 9 punti.  Richiedo la stampa del verbale in italiano tramite wifi, stampa anche la comunicazione.",28.00893807411194,0.8023255813953488,0.608318890814558,0.18653517728430888,0.5256410256410257,0.4871794871794871,351.0,unknown,unknown
Faster Whisper Tiny (Turbo)," procello con la sessura di un verba le per il veicolo macchina di ricola, ha capient panna,  ta creato trono un retenzi teren, di tipo speciale, proveniente da apportorarlo.  infaccione, è stata fievatta il 70% di tempi di alle ore sì, il teren, il veicolo si  provava in corso buono singalevesi, accivi con i neti dei tà, infarché gendoppia fija,  piuando l'atticolo con macchina, le scolice stralale, l'agente all'essandro morettista  provenuto alla contestazione immediata dell'infrazione, la vivazione comporta la verità di  neto, richiedo la stampa del verba le metalliano tramite spifi, stampa anche la comunicazione.","Procedo con la stesura di un verbale per il veicolo macchina agricola, marca Fiat Panda, targato CD123AB (di tipo speciale), proveniente da portogallo.  L'infrazione è stata rilevata il 17/04/2025 alle ore 06:33. Il veicolo si trovava in corso Buenos Aires, al civico 98, in parcheggio in doppia fila, violando l'articolo 4, comma 2, del codice stradale. L'agente Alessandro Moretti ha provveduto alla contestazione immediata dell'infrazione. La violazione comporta la perdita di 9 punti.  Richiedo la stampa del verbale in italiano tramite wifi, stampa anche la comunicazione.",4.114281415939331,0.7325581395348837,0.31542461005199307,0.09973552777256603,0.46315789473684216,0.45263157894736844,183.0,unknown,unknown
Vosk STT (Small IT),procedo con l'assessora di un verbale per il veicolo macchina ricola a cafiero panda targato sono tenti tre di tipo speciale proveniente da portogallo infrazione e stata rilevata il senza impotenti tenti si e alle ore si il fissare il veicolo si trovava in corso buenos aires si a ci con inetti deità in parcheggia in doppia fila violando l'articolo foto con matto l'ascoli c'è stradale l'agente alessandro moretti ha provveduto alla contestazione immediata dell'infrazione l'aviazione comporta la perdita di nine richiedo la stampa del verbale italiano tramite i fi stampa anche la comunicazione,"Procedo con la stesura di un verbale per il veicolo macchina agricola, marca Fiat Panda, targato CD123AB (di tipo speciale), proveniente da portogallo.  L'infrazione è stata rilevata il 17/04/2025 alle ore 06:33. Il veicolo si trovava in corso Buenos Aires, al civico 98, in parcheggio in doppia fila, violando l'articolo 4, comma 2, del codice stradale. L'agente Alessandro Moretti ha provveduto alla contestazione immediata dell'infrazione. La violazione comporta la perdita di 9 punti.  Richiedo la stampa del verbale in italiano tramite wifi, stampa anche la comunicazione.",3.748135566711426,0.6162790697674418,0.24956672443674177,0.2346415143168734,0.6875,0.6770833333333333,144.0,unknown,unknown
Wav2Vec2 XLSR Italian (Grosman),procedo con lassesura di un verbale per il veicolo macchina agricola pacapipand tergato troneongre denti terea di tipo speciale proveniente da portogalloinfrazione è stata rilevata il sentenfortenti tentifiche alleoresi il treil vehicolo si trovava in corso buonosiaesi a civiconineti de ità in parcheggio in doppiafia violando l'aco foro commatto del colice stradalela gente alessandro moretti approvveduto alla contestazione immediata dell'infrazionela violazione comporta la perditadi ninepunrichiedo la stampa del verbale in italiano tramite ifi sampa nche la comunicazione,"Procedo con la stesura di un verbale per il veicolo macchina agricola, marca Fiat Panda, targato CD123AB (di tipo speciale), proveniente da portogallo.  L'infrazione è stata rilevata il 17/04/2025 alle ore 06:33. Il veicolo si trovava in corso Buenos Aires, al civico 98, in parcheggio in doppia fila, violando l'articolo 4, comma 2, del codice stradale. L'agente Alessandro Moretti ha provveduto alla contestazione immediata dell'infrazione. La violazione comporta la perdita di 9 punti.  Richiedo la stampa del verbale in italiano tramite wifi, stampa anche la comunicazione.",16.913729906082153,0.5581395348837209,0.24783362218370883,0.23779480713112233,0.5529411764705884,0.5529411764705884,143.0,unknown,unknown
Wav2Vec2 XLS-R 1B Italian Robust (DBDMG),crocedo con lassesura di un vervale per il vecolo macchina arvicola a capiar panna tareva tottone a unvelutenti i terea di ticospeciale proveniente da portoralo infanzione e sata pilevata il senta infortentitenti fie alleoresi il tittere il vencolo si trovava in corso buono siglaesi a civico mineti delità inparcheggendoppia fia io ando la ticofoo commatto pelcorice e stravale la gente allessandoro moretti approvveduto alla contessazione immediata dellinfrazion la vivazione comporta la perdita di nine pun li chiedo la tampa del vervale initaliano framite ifi sampa anche la comoninazioni,"Procedo con la stesura di un verbale per il veicolo macchina agricola, marca Fiat Panda, targato CD123AB (di tipo speciale), proveniente da portogallo.  L'infrazione è stata rilevata il 17/04/2025 alle ore 06:33. Il veicolo si trovava in corso Buenos Aires, al civico 98, in parcheggio in doppia fila, violando l'articolo 4, comma 2, del codice stradale. L'agente Alessandro Moretti ha provveduto alla contestazione immediata dell'infrazione. La violazione comporta la perdita di 9 punti.  Richiedo la stampa del verbale in italiano tramite wifi, stampa anche la comunicazione.",40.210991859436035,0.7906976744186046,0.3188908145580589,0.07731747693943987,0.3222222222222222,0.31111111111111117,184.0,unknown,unknown
