model,text,reference,time,wer,cer,bleu_avg,rouge1_avg_f1,rougeL_avg_f1,levenshtein_avg,coqui_model,speaker_gender
Whisper Distilled IT (bofenghuang),"procedo con la stesura di un verbale per il veicolo ciclomotore, marca vun, serie ione, targato veseveno undre dei diti nini di tipo copertura, proveniente da germania. l'infrazione, stata rilevata il five for 20-20 five alle ore tarei, 20 sis. il veicolo si trovava in via giuseppe mazzini, al civico 24 a vintransito in zona accesso vietato, violando l'art","Procedo con la stesura di un verbale per il veicolo ciclomotore, marca BMW Serie 1, targato GH789IJ (di tipo copertura), proveniente da germania.  L'infrazione è stata rilevata il 05/04/2025 alle ore 03:26. Il veicolo si trovava in via Giuseppe Mazzini, al civico 24, in transito in zona accesso vietato, violando l'articolo 6, comma 1a(1-12), del codice penale. Non è stato possibile effettuare la contestazione immediata a causa dell'assenza del trasgressore, quindi motivo mancata contestazione: assenza del trasgressore. La violazione comporta la perdita di 1 punti.  Richiedo la stampa del verbale in italiano tramite bluetooth, stampa anche la comunicazione.",10.399554252624512,0.7551020408163265,0.6370481927710844,0.1827324293161179,0.5421686746987953,0.5301204819277108,423.0,unknown,unknown
Faster Whisper Tiny (Turbo)," procedo con la stessura di un verba le per il veicolo ciclomotore, marcavun, seri eone,  taggato che se venondre dei diti inine i diti poco pertura, proveniente da germania.  l'infrazione è stata rilevata il fivre fortuenti tventi fide alle ore tere e tventi si.  il veicolo si trovava in 10 juse per mazzini, al civico tventi furò a vintranzi tu in zona accesso di etato,  di andola articolo si, con mone a un minusto elve, e il codice final.  non è stato possibile effettuare la contestazione immediata causa della senza del tras cresore,  quindi motivo mancata contestazione, a senza del tras cresore.  la violazione comporta la perdita di one punti, richiedo la stampa del verba le initaliano tramite blu e toto,  stampa anche la comunicazione.","Procedo con la stesura di un verbale per il veicolo ciclomotore, marca BMW Serie 1, targato GH789IJ (di tipo copertura), proveniente da germania.  L'infrazione è stata rilevata il 05/04/2025 alle ore 03:26. Il veicolo si trovava in via Giuseppe Mazzini, al civico 24, in transito in zona accesso vietato, violando l'articolo 6, comma 1a(1-12), del codice penale. Non è stato possibile effettuare la contestazione immediata a causa dell'assenza del trasgressore, quindi motivo mancata contestazione: assenza del trasgressore. La violazione comporta la perdita di 1 punti.  Richiedo la stampa del verbale in italiano tramite bluetooth, stampa anche la comunicazione.",2.1651525497436523,0.7448979591836735,0.28463855421686746,0.19933176306696201,0.5701754385964912,0.5526315789473685,190.0,unknown,unknown
Vosk STT (Small IT),procedo con la stesura di un verbale per è il veicolo ciclomotori marca serie one targato che seven un tre dei di nei di tipo copertura proveniente da germania l'infrazione stata rilevate il five fortuna enti tu enti five alle ore tarea venti si il veicolo si trovava in via giuseppe mazzini al civico tu enti fury ha intransigenza una accesso vietato di gando l'articolo si con me ne ha un minuto erbe e il codice penale non è stato possibile effettuare la contestazione immediata a causa dell'assenza del trasgressori quindi motivo mancata contestazione assenza del trasgressori la violazione comporta la perdita di one punti richiedo la stampa del verbale in italiano tramite due toto stampa anche la comunicazione,"Procedo con la stesura di un verbale per il veicolo ciclomotore, marca BMW Serie 1, targato GH789IJ (di tipo copertura), proveniente da germania.  L'infrazione è stata rilevata il 05/04/2025 alle ore 03:26. Il veicolo si trovava in via Giuseppe Mazzini, al civico 24, in transito in zona accesso vietato, violando l'articolo 6, comma 1a(1-12), del codice penale. Non è stato possibile effettuare la contestazione immediata a causa dell'assenza del trasgressore, quindi motivo mancata contestazione: assenza del trasgressore. La violazione comporta la perdita di 1 punti.  Richiedo la stampa del verbale in italiano tramite bluetooth, stampa anche la comunicazione.",1.9653730392456055,0.6326530612244898,0.2560240963855422,0.2853541541859591,0.6964285714285715,0.6964285714285715,170.0,unknown,unknown
Wav2Vec2 XLSR Italian (Grosman),procedo con la stesura di un verbale per il veicolo ciclomotore marchabum serione targato vesevenondre dei diti imineiditipo copertura proveniente da germania l'infrazione stata rilevata il fivefortuenti tuenti file alle ore teree twentisisil veicolo si trovava in via giuseppe mazzini al civico tuenti furo a pintransito in zona accesso vietato diandol'articolocon mauneone-minustuelve del codice pinale non è stato possibile effettuare la contestazione immediata a causa dell'assenza del trasgressore quindi motivo mancata contestazione assenza del trasgressore la violazione comporta alla perdita di one punti richiedo la stampa del verbale in italiano tramite blue toto stampa anche la comunicazione,"Procedo con la stesura di un verbale per il veicolo ciclomotore, marca BMW Serie 1, targato GH789IJ (di tipo copertura), proveniente da germania.  L'infrazione è stata rilevata il 05/04/2025 alle ore 03:26. Il veicolo si trovava in via Giuseppe Mazzini, al civico 24, in transito in zona accesso vietato, violando l'articolo 6, comma 1a(1-12), del codice penale. Non è stato possibile effettuare la contestazione immediata a causa dell'assenza del trasgressore, quindi motivo mancata contestazione: assenza del trasgressore. La violazione comporta la perdita di 1 punti.  Richiedo la stampa del verbale in italiano tramite bluetooth, stampa anche la comunicazione.",10.029839038848877,0.4489795918367347,0.22740963855421686,0.35933627710523286,0.7450980392156863,0.7450980392156863,151.0,unknown,unknown
Wav2Vec2 XLS-R 1B Italian Robust (DBDMG),procedo con nastesura di unverbale per il veicolo ciclomotore marcamo serione targato che se venno undre dei ditinnidi tico copertura proveniente da germani infrazione stata rilevata i fide fortoentituenti fide alle ore terei tuenti sisil veicolo si trovava invia giusetpemazini pal civicotuenti furove ntransito inzona accesso vietato diando larticolo si con moneaniminusto elve del codice penale non è stato possibile effettuare la contestazione imvediata a causa dellassenza del trascressore quindinotivo mancata contestazione a senza del trascressore la violazione comporta alla perditadione punti richiedo la stampa del verbale in italiano tramite luetoto stampa anche la comunicazione,"Procedo con la stesura di un verbale per il veicolo ciclomotore, marca BMW Serie 1, targato GH789IJ (di tipo copertura), proveniente da germania.  L'infrazione è stata rilevata il 05/04/2025 alle ore 03:26. Il veicolo si trovava in via Giuseppe Mazzini, al civico 24, in transito in zona accesso vietato, violando l'articolo 6, comma 1a(1-12), del codice penale. Non è stato possibile effettuare la contestazione immediata a causa dell'assenza del trasgressore, quindi motivo mancata contestazione: assenza del trasgressore. La violazione comporta la perdita di 1 punti.  Richiedo la stampa del verbale in italiano tramite bluetooth, stampa anche la comunicazione.",25.35504150390625,0.6632653061224489,0.2545180722891566,0.17491174874851334,0.5252525252525252,0.5252525252525252,169.0,unknown,unknown
"Wav2Vec2 XLSR Multilingual (voidful, 56 lang)",procedo con la stesura di un verbale per il veicolo ciclomotore marcamon serione targatodesevenondre dei ditini di tipocopettura proveniente da germania infrazione stata rilevata il fvefurtuitentifilealleore tereepuentisis il veicolo si trovava india giuseppe mazinialcivico tuentifurav intransito insonaaccesso vietato diando larticolo sconmoneane minustoelve del codice penale non è stato possibile effettuare la contestazione immediata causa dellassenza del tresgressore quindi motivo mancata contetaione assenza del trasgressore la violazione comporta la perditadione punti richiedo la stampa del verbale in italiano tramite buetoto stampa anche la comunicazione,"Procedo con la stesura di un verbale per il veicolo ciclomotore, marca BMW Serie 1, targato GH789IJ (di tipo copertura), proveniente da germania.  L'infrazione è stata rilevata il 05/04/2025 alle ore 03:26. Il veicolo si trovava in via Giuseppe Mazzini, al civico 24, in transito in zona accesso vietato, violando l'articolo 6, comma 1a(1-12), del codice penale. Non è stato possibile effettuare la contestazione immediata a causa dell'assenza del trasgressore, quindi motivo mancata contestazione: assenza del trasgressore. La violazione comporta la perdita di 1 punti.  Richiedo la stampa del verbale in italiano tramite bluetooth, stampa anche la comunicazione.",10.393887281417847,0.5306122448979592,0.22590361445783133,0.269269358913382,0.6451612903225806,0.6451612903225806,150.0,unknown,unknown
Whisper Tiny (OpenAI)," il popo 20 tentifiche alle ore sto portifolo sto mettendo una nottitita di infrazione per il veicolo setteglizza, io ho chi è un mal ricolato in francia contarla, potere un retempo nel limite trovo. infrazione si è verificata per esso vi hanno settemne, acicofiche, io ando il codice venale, in particolare l'atticolo si, con ma forri guardante il parque giù davanti a passo carabio. devo","Il 04/04/2025, alle ore 02:44, sto emettendo una notifica di infrazione per il veicolo Seat Ibiza, rimorchio immatricolato in francia con targa UV321WX di tipo prova. L'infrazione si è verificata presso via XX Settembre, al civico 5, violando il codice penale, in particolare l'articolo 6, comma 4 riguardante il parcheggio davanti a passo carrabile.Devo decurtare 6 punti. Applico una sanzione accessoria in base alle circostanze. Non sono necessari ulteriori dettagli sul rimorchio. Stampamelo con il bluetooth in italiano, stampa anche la comunicazione.",1.6597437858581543,0.8536585365853658,0.5773381294964028,0.08882945936197471,0.3443708609271523,0.33112582781456956,322.0,unknown,unknown
Whisper Distilled IT (bofenghuang),"il fulfor 20-30 file, alle ore 4, sto emettendo una notifica di infrazione per il veicolo 7-biza, primo archio immatricolato in francia con tarla, un terremoto e le tento nei liti pop-pro. l'infrazione si è verificata presso via nel settembre, al 5 fine, violando il codice penale, in particolare l'articolo sì, con mafor riguardante il parcheggio davanti a passo cara via. devo dec","Il 04/04/2025, alle ore 02:44, sto emettendo una notifica di infrazione per il veicolo Seat Ibiza, rimorchio immatricolato in francia con targa UV321WX di tipo prova. L'infrazione si è verificata presso via XX Settembre, al civico 5, violando il codice penale, in particolare l'articolo 6, comma 4 riguardante il parcheggio davanti a passo carrabile.Devo decurtare 6 punti. Applico una sanzione accessoria in base alle circostanze. Non sono necessari ulteriori dettagli sul rimorchio. Stampamelo con il bluetooth in italiano, stampa anche la comunicazione.",10.63797926902771,0.6585365853658537,0.5089928057553957,0.2875546226573057,0.5454545454545454,0.5194805194805195,283.0,unknown,unknown
Faster Whisper Tiny (Turbo)," il popo 20 tentifiche, all'oresto, portipolo, sto emettendo una nottitita di infrazione per i veicolo  sedeglizza, io ho chi è matricolato in francia con tarlà, poter è un reletento negli  diti troppo. in infrazione si è verificata per esso vianne e settemne, acicofive,  io l'anno il codice venale, in particolare l'attipolo si, con ma forriguardo andante il  parque giù davanti a passo carabio. devo adegurtare si può, appri con assanzione a ce soli  in basa alle circostanze. non sono necessari ulteriori dettagli su rimocchio, stampavelo  con il due tognita all'anno, stampa anche la comuni, ciò.","Il 04/04/2025, alle ore 02:44, sto emettendo una notifica di infrazione per il veicolo Seat Ibiza, rimorchio immatricolato in francia con targa UV321WX di tipo prova. L'infrazione si è verificata presso via XX Settembre, al civico 5, violando il codice penale, in particolare l'articolo 6, comma 4 riguardante il parcheggio davanti a passo carrabile.Devo decurtare 6 punti. Applico una sanzione accessoria in base alle circostanze. Non sono necessari ulteriori dettagli sul rimorchio. Stampamelo con il bluetooth in italiano, stampa anche la comunicazione.",2.0589752197265625,0.7560975609756098,0.3327338129496403,0.09134764372326154,0.43715846994535523,0.4153005464480874,186.0,unknown,unknown
Vosk STT (Small IT),forza intenti fine alle ore to forti forse sto mettendo una notifica di infrazione per il veicolo state vita i morti e matricola in francia con la punterei ho detto lei di tipo infrazione si e verificata presso via nel settembre a chicago fire violando il codice penale in particolare l'articolo si con ma for riguardante il parcheggio davanti a passo arabi devo decurtare si può applico la sanzione accessoria in base alle circostanze non sono necessarie ulteriori dettagli sul rimorchio va me lo con due volte in italiano sa anche la comuni signore,"Il 04/04/2025, alle ore 02:44, sto emettendo una notifica di infrazione per il veicolo Seat Ibiza, rimorchio immatricolato in francia con targa UV321WX di tipo prova. L'infrazione si è verificata presso via XX Settembre, al civico 5, violando il codice penale, in particolare l'articolo 6, comma 4 riguardante il parcheggio davanti a passo carrabile.Devo decurtare 6 punti. Applico una sanzione accessoria in base alle circostanze. Non sono necessari ulteriori dettagli sul rimorchio. Stampamelo con il bluetooth in italiano, stampa anche la comunicazione.",2.178492784500122,0.6097560975609756,0.2607913669064748,0.22779375728029025,0.6153846153846153,0.6153846153846153,145.0,unknown,unknown
Wav2Vec2 XLSR Italian (Grosman),il fu fortentitenti file a leoretto portifolo stoi mettendo una notifica di infrazione per il veicolo set e viza rimorchio immatricolato in francia contaga muterrei un grevetentoneri di tipo pproil'infrazione si è verificata presso via  settembre al cicofile violando il codice penale in particolare l'artcolo sia con ma forri guardante il parcheggio davanti a passo carabinedevo decurtare si po aprico una sanzione accessoria in base alle circostanzenon sono necessari ulteriori dettagli sul rimorchiostam pavelo co il bluedoto in italiano stampa anche la comunicazione,"Il 04/04/2025, alle ore 02:44, sto emettendo una notifica di infrazione per il veicolo Seat Ibiza, rimorchio immatricolato in francia con targa UV321WX di tipo prova. L'infrazione si è verificata presso via XX Settembre, al civico 5, violando il codice penale, in particolare l'articolo 6, comma 4 riguardante il parcheggio davanti a passo carrabile.Devo decurtare 6 punti. Applico una sanzione accessoria in base alle circostanze. Non sono necessari ulteriori dettagli sul rimorchio. Stampamelo con il bluetooth in italiano, stampa anche la comunicazione.",7.056699991226196,0.5,0.22482014388489208,0.3201348104550534,0.6198830409356725,0.6081871345029239,125.0,unknown,unknown
Wav2Vec2 XLS-R 1B Italian Robust (DBDMG),il fu fortenti tenti file alleoretto porti foro soi mettendo una notifita dinfazione per il vecolo sete e vizza i molché i maticolato in francia contalla untereungeletento rei di tipo pro glinfazione si a verificata peresso via nezzettembre alcico file io lando il codice penale inparticolare larticolo si con ma fo riguardante il parcheggio davanti a passo caravi devode curtare si pu aplico una sanzione accessolia in vase alle cercostanze non sono necessari ulterioridetta gli sul rimorchio sampaavelo con il due tote in italiano sampa anche la comuninaioni,"Il 04/04/2025, alle ore 02:44, sto emettendo una notifica di infrazione per il veicolo Seat Ibiza, rimorchio immatricolato in francia con targa UV321WX di tipo prova. L'infrazione si è verificata presso via XX Settembre, al civico 5, violando il codice penale, in particolare l'articolo 6, comma 4 riguardante il parcheggio davanti a passo carrabile.Devo decurtare 6 punti. Applico una sanzione accessoria in base alle circostanze. Non sono necessari ulteriori dettagli sul rimorchio. Stampamelo con il bluetooth in italiano, stampa anche la comunicazione.",18.444904804229736,0.7317073170731707,0.2751798561151079,0.09718266821532935,0.4114285714285714,0.39999999999999997,153.0,unknown,unknown
"Wav2Vec2 XLSR Multilingual (voidful, 56 lang)",il fu fortaintitentifine a leoretto portiforo soemettendo una notifica di infraczione per il veicolose tebizza imorche in magricolato in francia contarla ontereunreetento neriditico pror infraczione siè verificata per e sovianesettembre a chicofile violando il codice penale in particolare larticolosi comma for riguardante il parcheggio davantiapassocarabia devò de curtare si pun applico una sanzione accessoria in vase alle cercostanze non sono necessario usterioridetta di sul rimorchio sampamelo con il bluedo te in italiano sanpa anche la comunicazione,"Il 04/04/2025, alle ore 02:44, sto emettendo una notifica di infrazione per il veicolo Seat Ibiza, rimorchio immatricolato in francia con targa UV321WX di tipo prova. L'infrazione si è verificata presso via XX Settembre, al civico 5, violando il codice penale, in particolare l'articolo 6, comma 4 riguardante il parcheggio davanti a passo carrabile.Devo decurtare 6 punti. Applico una sanzione accessoria in base alle circostanze. Non sono necessari ulteriori dettagli sul rimorchio. Stampamelo con il bluetooth in italiano, stampa anche la comunicazione.",7.593475580215454,0.6585365853658537,0.25719424460431656,0.08600213438676092,0.47852760736196326,0.45398773006134974,143.0,unknown,unknown
Whisper Tiny (OpenAI)," sì lo pifico un previso operativo al veicolo ma chi nalri col attargetto a oppone un retenzi tra i tipico, prova proveniente da grecia. acca, un misteriore, la violazione, confero, parche il gendivito di sosta. sì è verificata in data tenti, se ventre i tenti tenti fì alle ore forze, se ventre in gli alle del jacini, al numero e rinta. l'infrazione, che entra nella tip","Si notifica un preavviso relativo al veicolo macchina agricola targato AB123CD di tipo prova proveniente da grecia, marca BMW Serie 1. La violazione, ovvero parcheggio in divieto di sosta, si è verificata in data 27/03/2025 alle ore 04:17 in viale dei Giardini, al numero 8. L'infrazione rientra nell'articolo 157, comma 5 del codice penale. Non è stato possibile contestare immediatamente a causa dell'assenza del trasgressore, motivo mancata contestazione: assenza del trasgressore. La sanzione prevede la perdita di 9 punti. Si richiede la stampa in lingua italiano, tramite wifi, stampa anche la comunicazione.",1.7412824630737305,0.9347826086956522,0.6351791530944625,0.048947458906173934,0.28395061728395066,0.25925925925925924,391.0,unknown,unknown
Whisper Distilled IT (bofenghuang),"si notifica un preavviso relativo al veicolo macchinario con la targata o buone ungheri tenti il terretto di tipo, prova proveniente da grecia, ma cambia in serie ore. la violazione, ovvero parcheggio in divieto di sosta, si è verificata in data tenti se ventere tenti tenti figli alle ore forse ventenni in viale del giacchini, al numero rita. l'infrazione, rientra nell'articolo, o ne","Si notifica un preavviso relativo al veicolo macchina agricola targato AB123CD di tipo prova proveniente da grecia, marca BMW Serie 1. La violazione, ovvero parcheggio in divieto di sosta, si è verificata in data 27/03/2025 alle ore 04:17 in viale dei Giardini, al numero 8. L'infrazione rientra nell'articolo 157, comma 5 del codice penale. Non è stato possibile contestare immediatamente a causa dell'assenza del trasgressore, motivo mancata contestazione: assenza del trasgressore. La sanzione prevede la perdita di 9 punti. Si richiede la stampa in lingua italiano, tramite wifi, stampa anche la comunicazione.",10.469585180282593,0.8152173913043478,0.6009771986970684,0.20383303414015772,0.5,0.4625,369.0,unknown,unknown
Faster Whisper Tiny (Turbo)," sì lo pifico un previso operativo al veicolo macchina ricola  tagliato a oppone un retenzi teretti di tipo prova proveniente da  grecia.  acca, un misteriore, la violazione, con vero, parche del  individuo di sosta, si è verificata in nata tenti e  se venceretenti tentifili alle ore forze, se venteni in diale  del jacini, al numero interna.  l'infrazione, che entra nell'atticolo, pone un  reettiti se ne, con macchia del coisce penale.  non è stato possibile contestare immediatamente a causa  dell'assento del trasfresore, motivo mancata contestazione,  assento del trasfresore.  la sancione prevede la verità di nine come.  sì di chiede la stampa in lingua italiano, tramite stiti, stampa anche  la comunazione.","Si notifica un preavviso relativo al veicolo macchina agricola targato AB123CD di tipo prova proveniente da grecia, marca BMW Serie 1. La violazione, ovvero parcheggio in divieto di sosta, si è verificata in data 27/03/2025 alle ore 04:17 in viale dei Giardini, al numero 8. L'infrazione rientra nell'articolo 157, comma 5 del codice penale. Non è stato possibile contestare immediatamente a causa dell'assenza del trasgressore, motivo mancata contestazione: assenza del trasgressore. La sanzione prevede la perdita di 9 punti. Si richiede la stampa in lingua italiano, tramite wifi, stampa anche la comunicazione.",2.284943103790283,0.6956521739130435,0.3566775244299674,0.21365222966247563,0.5145631067961165,0.5145631067961165,220.0,unknown,unknown
Vosk STT (Small IT),tipico preavviso appellativo al veicolo macchinari ricola targato buone tenti faresti di tipo prova proveniente da grecia vacca serie ho l'aviazione ovvero perche agente divieto di sosta si e verificata in data attenti senza rete insistenti figlia le ore forza intendi inviare ed è già fini al numero l'infrazione rientra nella piccolo congressisti se con ma del codice penale non è stato possibile contestare immediatamente a causa dell'assenza del trasgressori motivo mancata contestazione assenza del trasgressori la sanzione prevede la perdita di nine può si richiede la e lingua italiano tramite i si sa anche la comunicazione,"Si notifica un preavviso relativo al veicolo macchina agricola targato AB123CD di tipo prova proveniente da grecia, marca BMW Serie 1. La violazione, ovvero parcheggio in divieto di sosta, si è verificata in data 27/03/2025 alle ore 04:17 in viale dei Giardini, al numero 8. L'infrazione rientra nell'articolo 157, comma 5 del codice penale. Non è stato possibile contestare immediatamente a causa dell'assenza del trasgressore, motivo mancata contestazione: assenza del trasgressore. La sanzione prevede la perdita di 9 punti. Si richiede la stampa in lingua italiano, tramite wifi, stampa anche la comunicazione.",2.2343389987945557,0.6195652173913043,0.2947882736156352,0.21297381174721253,0.6082474226804124,0.5979381443298969,181.0,unknown,unknown
Wav2Vec2 XLSR Italian (Grosman),si notifica un preavviso relativo al veicolo macchina agricola attergato boneongretenti treditipo prova proveniente da greciapa vmezerieolela violazione con vero parcheggio indivieto di sosta si è verificata in data tenti seventeretenti tenti fili alleore forze ntenni inviare dei giardini annumerital'infrazione rientra nellart oneungrefiti semea con maffia del codice penalenon è stato possibile contestare immediatamente a causa dell'assenza del trasgressore motivo mancata contestazione assenza del trasgressorela sanzione prevede la verdita dininepolesi richiede la stampa in lingua italiano tramite ifi stampa anche la comunicazione,"Si notifica un preavviso relativo al veicolo macchina agricola targato AB123CD di tipo prova proveniente da grecia, marca BMW Serie 1. La violazione, ovvero parcheggio in divieto di sosta, si è verificata in data 27/03/2025 alle ore 04:17 in viale dei Giardini, al numero 8. L'infrazione rientra nell'articolo 157, comma 5 del codice penale. Non è stato possibile contestare immediatamente a causa dell'assenza del trasgressore, motivo mancata contestazione: assenza del trasgressore. La sanzione prevede la perdita di 9 punti. Si richiede la stampa in lingua italiano, tramite wifi, stampa anche la comunicazione.",8.588127136230469,0.5108695652173914,0.23941368078175895,0.2918930234057166,0.6179775280898876,0.6179775280898876,147.0,unknown,unknown
Wav2Vec2 XLS-R 1B Italian Robust (DBDMG),sinotifico unpravviso pelativo al vecolo macchinaricola cargato cone ungeletenti i terettio di sico prova proveniente da grescia a ca bumnserioni la vilazione con vero parche gendilieto di sosta si e verificata in data tenti i se le intere tenti tenti filia alleore forzente nninviale dei giapini al numerita glinfazione ientra nellarticolo ome unrifitti sée con ma fila del colice e penal non è stato possi vile contestare immelieramente a causa della senza del traspre sone motivo mancata contestazione a senza del traspre sore la sanzione prevedella perdita di nine pun si richiede la stampa in lingua italiano tramite difi sampa anche la comoninazioni,"Si notifica un preavviso relativo al veicolo macchina agricola targato AB123CD di tipo prova proveniente da grecia, marca BMW Serie 1. La violazione, ovvero parcheggio in divieto di sosta, si è verificata in data 27/03/2025 alle ore 04:17 in viale dei Giardini, al numero 8. L'infrazione rientra nell'articolo 157, comma 5 del codice penale. Non è stato possibile contestare immediatamente a causa dell'assenza del trasgressore, motivo mancata contestazione: assenza del trasgressore. La sanzione prevede la perdita di 9 punti. Si richiede la stampa in lingua italiano, tramite wifi, stampa anche la comunicazione.",22.668161153793335,0.7934782608695652,0.31596091205211724,0.08033704898387814,0.40201005025125625,0.40201005025125625,194.0,unknown,unknown
